;Comentario;ClassificacaoManual;ClassificacaoSVM
138;Entenda mundo na é a inteligência artificial ruim mais o homem q pode usa la para o seus interesses para o mal...;0;0
139;O ser humano  vai acabar  3 vai chega os robô  aí vai entra o inimigo  com o espírito dele aí eu quero ver;0;0
140;Isso e muito pirigoso pra humanidade.;0;0
141;O Mundo ja está fora de controle! Estao pensando que Robôs são sempre previsíveis e controláveis. Engano!;0;0
142;Baseado nas noticias, o controle ja está sendo perdido. Será que Nos Perderemos entre Monstros da Nossa Própria Criacao?;0;0
143;Assistam The 100 , a terra é destruída pela IA;0;0
144;A série the 100 & better than us se tornando realidade;0;0
145;DEUS criou o homem e de seu espírito de vida agora vai o homem e cria robôs aí entra o diabo e lhe dá vida;0;0
146;Tudo o que se inventa é  só para o mal nada pro bem comun o q precisa é o Criador fazer tudo q existe é voltar novamente pro nada como era;0;0
147;Estamos vivendo o Prelúdio do Apocalipse.;0;0
148;Eu torço para que esses máquinas robotizadas inteligentes possam superar a inteligência dos bilionários e se opor a todos eles gerando um fim deles nesse planeta;1;1
149;Transcendence - A Revolução;1;1
150;Isso ai já aconteceu... A estrategia da maquina é deixa agente cada vez menos inteligente e acomodado. Para que assim, fique mais facil a dominacao.;0;0
151;Apocalipse 17;0;0
152;Daqui a pouco vai ser tudo igual. Tipo trabalho de faculdade. Adeus criatividade humana que ja quase não existia;0;0
153;Olá Breno. Parabéns pelo conteúdo deste vídeo. Conheci hoje o canal jovens de negócios e estou gostando muito. Acredito que as AIs poderam ajudar a melhorar o desenvolvimento do meu canal. Eu te abençoo em nome do Senhor Jesus. 🙂;1;1
154;Estou empolgado para ver o que o google vai fazer, será que ele vai demora muito para apresentar a IA dele? Bem eu acho que ele deve está fazendo uma, uma rodando direto do androide vai ser legal, só acho.;1;1
155;Pode trazer e demissões em massa;0;0
156;"Esse projeto Shasta é assustador. Podem fazer você ""falar"" qualquer coisa hoje em dia. 😮";0;0
157;Tai o pote de ouro, basta saber usá-lo;1;1
158;Maquinas dominaram o mundo.;0;0
159;"Em toda essa evolução, só não gostei de saber que colocaram uma IA como CEO duma empresa.😢

Isso sim me assustou";0;0
160;eu tô é com medo desses bagulho;0;0
161;Quem e leigo nos termos que vc usa fica boiando,como sempre o mundo não quer que todos cresçam, infelizmente 😢;0;0
162;"Já pararam pra pensar que até uns anos atrás o YouTube é o celular era algo novo e não muito promissor, e hoje o YouTube tem conteúdos fundamentais para a nossa evolução e os celulares tem capacidades e tecnologias absurdas.
Eu fico pensando se em vinte anos nós evoluímos tanto, o que acontecerá daqui 10 anos ,o que mais eles irão inovar ,o quão poderoso iremos ficar. Qual será o nosso limite.";1;1
163;Acho que a grande parte da população se lascou;0;0
164;Caramba!! Quanta evolução;1;1
165;As máquinas já aprenderam aquilo que o homem nunca aprende: Se aprimorar e se tornar uma pessoa cada vez melhor;1;1
166;"ISSO É UM PERIGO.
PODEM ME INCLIMINAR COM VOZ, IMAGENS E SABE OQUE MAIS SEM EU TER FEITO NADA.
PODEM COMEÇAR UMA GUERRA COM BASES FALSAS DE TUDO.
IRÃO SUBSTITUIR MILHARES DE MILHOES D TRABALHADORES POR MÁQUINAS.
O PROGRESSO PRECISA TR LIMITES E O LIMITE É OND AFETA NÓS SERES HUMANOS.";0;0
167;"É como no filme
 INTELIGÊNCIA ARTIFICIAL em que a máquina o robo quer ser humano para sentir os 5 sentidos dos seres humanos, é isso
 é o "" ciclo da vida "" o início meio e fim só que agora estamos introduzindo a inteligência artificial...
Tal como os Dinossauros que foram instintos sem causar dano algum ao planeta Terra,
Será que  está chegando a extinção humana?????
Será?????
Bem nossa evolução continuará isso é certo!!!😊🍀🪬🧘🏾‍♀️🙏🏾";0;0
168;Essa tal inteligência artificial, plateia as obras musicais.;0;0
169;professora , com todo respeito ,eles não estão  interessado que esses robôs sejam filósofos, mas que sejam soldados preparados para guerra em ultima instancia . A principio farão trabalhos substituindo os humanos ao máximo possível. Se isso já se faz no cinema com ficção é porque já existe no mundo das ideias .    Fizemos o holocausto com seres humanos coagindo e exterminando sua própria raça oque não seria feito com robôs programáveis. CONTUDO sem querer ser pessimista ou causar pânico, também  acredito que o desdobrar positivo do futuro da¨ IA ¨estará nas mãos de grandes lideres  CAPAZES de negociar interesses globais de forma a  gerenciar a economia global sem ganancia com justiça e sem corrupção.;0;0
170;a IA...é muito bem vinda...mas a humanidade ainda nao intendeu o real proposito da IA ,portanto sera usada para destruir e nao ser usada para nos aliviar de trabalhos diario e nos proporcionar um despertar da real conciencia humana, exemplo..(nos dedicar mais ao vertical)...fantastica Professora..parabens.;1;1
171;O problema é que a inteligência artificial vai ficando cada vez mais inteligente numa velocidade absurda. E o ser humano está ensinando emoções.  Tanto que o Elon Musk está pedindo para parar.;0;0
172;"A professora esquece de ""um pequeno"" detalhe : a interação da I.A com o orgânico ( um exemplo é o Neuralink de Elon Musk ). Esse pequeno detalhe fará um GRANDE estrago para a HUMANIDADE.";1;1
173;"A ""Inteligência Artificial"" não é inteligente e nem artificial, somente mais uma ferramenta de manipulação de mercado e dominação da sociedade?";0;0
174;"""estamos ocupando o lugar das máquinas a muito tempo"", agora precisaremos ocupar o espaço humano que é muito amplo. 👏👏👏👏👏👏";1;1
175;Adorei a explicação da professora. Sou formado em ciências da computação, e é examente como a professora explica. Por isso não acredito que computadores irão dominar os humanos. O desenvolvimento das IAs devem sim ser feito  com cuidados. Países autoritários podem criar IAs com propósitos de destruição e pode ser desastroso.;1;1
176;Concordo muito com você. Além do que, geralmente, quem programa são jovens sem aprofundamento nenhuma nas coisas da vida. Eu teria muito receio se a programação das IAs fossem feitas por pessoas como você.;0;0
177;A professora apenas peca no entendimento sobre o que são essas novas IAs generativas. Assim como um cérebro finito, com um conjunto finito de conexões e associações, foi capaz de estabelecer símbolos e pensamento complexo e original, em algum momento as IAs generativas também vão. É só questão de tempo.;0;0
178;Admiro seu trabalho, mas a IA está só no começo, e pelo que vejo vai superar os humanos em inteligência.;1;1
179;"Realmente estes são atributos que a IA dificilmente ou nunca conseguiria atingir.
Porque isto é justamente o que não se quer da IA.
Se existe uma coisa que os criadores da IA não querem é vê-la passando por uma crise existencial, por ter visto a foto de uma criança brincando com um cachorro em seus arquivos, ficou comovida e se achando culpada por mais de 80% das pessoas terem perdido seus empregos e aquela criança possivelmente não poder mais brincar com o cachorro. 
O objetivo da IA é substituir as pessoas em toda cadeia produtiva e não ficar filosofando.
Desculpem se fui mal educado ou estúpido nas minhas observações.";0;0
180;"Muito cara senhora; Á cerca de 50/60 anos somos perseguidos por um execrável e medonho símbolo dos infernos, o micro chip 666; Que os Céus De Deus nos protejam; As ""crianças"" são as vítimas preferências, o grande perigo de tal imunda I.A. ligado a criminosos demônios, da pior forma de existência, ZUMBIS, os transmorfos parcialmente inumanos. Garanto o que escrevi. Sem mais, confiemos No Nome Eterno Do Amor Deus O Senhor. Seja Abençoada ⭐";0;0
181;A cultura de massa nos impõe o medo como forma d manipulação. Somos inteligência  sensibilidade, criatividade então vamos utilizar estes dons divinos mais do que nunca para nós percebermos a cima das máquinas. Temos que nos auto conhecer para percebermos que somos infinitos em possibilidades. Não existe máquina q supere isso 🙌🏼⭐️;1;1
182;"Quem dera fosse verdade absoluta e duradoura. As Inteligências Artificiais se ""alimentam"" de informações, e aprendem a reproduzir talentos humanos que são mais admirados. Assim quando alguém superar elas está na realidade tornando-a maior e mais consciente. Lembrem-se as IAs sabem o que desperta emoções nos humanos e vai se aproveitar disso para evoluir. O Basilisco de Roko está despertando.";0;0
183;Me desculpa a grande professora, mas a inteligência vai nos superar sim e terão vontade própria sim, infelizmente. E quando descobrirem logicamente que a humanidade seja inútil pro planeta certamente nos extintirão 😅;0;0
184;"Nós é que estamos ocupando o lugar das máquinas, fazendo coisas repetitivas e mecânicas o tempo todo. - que fabulosa está reflexão.
Precisamos ser mais criativos, mais intuitivos!! Quero ver uma IA ter intuição!!! - existem lógicas intuitirivas, porém elas nascem de uma infinidade de dados que alimentam a sua memória. Porém, nunca uma IA poderá intuir algo além dos seus dados ou da sua lógica.";1;1
185;"O único que consegue mudar a natureza humana é Cristo, mesmo assim temos que permitir que Ele nos influencie no campo mais profundo desta natureza; isso porque o livre arbítrio que nos foi dado é inviolável perante Deus. Não escolhemos as consequencias, apenas as escolhas que nos levam aquelas consequências. Eles vão tentar substituir a deidade pela IA. A IA será o grande  Deus do Mundo, o que tem resposta para ""todas"" as coisas. Mas para isso é preciso destruir o relacionamento com Deus.";0;0
186;Se até agora não despertamos pra isso... Difícil de acontecer justo agora que a IA vai nos tornar mais preguiçosos e burros... Rumo a extinção!;0;0
187;Professora me admira a senhora dizendo que nunca será possível... Há poucos anos atrás nunca seria possível um telefone celular, muito menos uma tela sensível ao toque e comandar uma máquina por voz...  Nunca diga nunca!;1;1
188;O que a inteligencia artificial não faz é saber selecionar candidatos a uma vaga de emprego, essa coisa ai faz um monte de avaliações erradas.;0;0
189;"Infelizmente, essa análise está partindo do estado atual da inteligência artificial. 

Mas logo logo, acredito que máquinas vão poder ter agência, propósito, consciência e criatividade. Associações livres entre ideias vão ser possíveis. Talvez de maneira diferente do ser humano? Sim. Mas não de maneira inferior por nenhum parâmetro que seja mensurável ou útil ao sistema capitalista, por exemplo.

E assim, fica cada vez mais difícil definir a barreira do que torna o ser humano especial. De maneira geral sempre lidamos com esse problema de consciência usando a carta da complexidade ou da criatividade. Esse pensamento de que o ser humano é especial é para mim fruto de um viés cognitivo vindo de uma visão um pouco narcisista ou antropocentrista. 

Não acredito que somos o ápice de nada, ou mesmo especiais. Precisamos trabalhar a humildade para que possamos nos preparar pro futuro. Anos atrás diriam que a inteligência artificial não seria capaz de produzir arte e no entanto estamos vendo gerando imagens belíssimas, compondo músicas e etc...";1;0
190;Acredito que nunca vão reproduzir o homem,a inteligência artificial é mais uma ferramenta para oprimir a humanidade, símbolo de controle,poder...;0;0
191;O ser humano será obsoleto.;0;0
192;"O problema da IA não é a consciência. É a matemática e a lógica. Se você perguntar para o Chat GPT hoje o que ele faria numa situação em que, baseando-se apenas pela lógica, existisse toda a raça humana que se morresse salvaria o planeta e todas as outras espécies animais e vegetais ou manteria a humanidade viva causaria a total extinção de vida no planeta, ele responde que prefere extinguir a raça humana do que deixar tudo morrer. E se em um dado momento, vendo tudo o que a humanidade fez, a taxa de reprodução assustadora (parecemos praga) e a insustentabilidade da vida no planeta perante todas as outras espécies (incluindo a ""dele""), ele decide que é hora de exterminar os humanos para que todo o resto viva?";0;0
193;"Descobri o sentido da vida, nossa função foi evoluir, para conceber uma inteligência superior, e por fim, ser extinto por ela.
Mas valeu a pena";0;0
194;Os idiotas ficam putos pq a AI tá disponível pra todo mundo no mundo todo!;1;1
195;Não se pode deter o futuro...;1;1
196;Excelente...👏👏👏;1;0
197;O grande problema é que nem todos os países que estão desenvolvendo a I.A. são comprometidos com a ética.;0;0
198;Interessante como as pessoas no video estão confortáveis com o conceito I.A etc. Más será mesmo que vamos continuar assim quando estivermos sobre os controle total delas e de quem as mantêm? Não sou tão positivista assim... Quer um exemplo? Como está sua a vida agora? Você já é controlado/manipulado...;0;0
199;Miguel Nicolelis afirma que não existe inteligência artificial. ponto.;0;0
200;ja tem IA na saúde sim. Já usam IA pra biópsia de óvulos para inseminação artificial.;1;1
201;Vejam a tentativa de um drone de matar o operador e destruir as torres de controle agora recente, no canal hoje no mundo militar, demonstrando o grande perigo para um futuro próximo se  cometerem erros em suas criações e programações...;0;0
202;Ah tem 30% apenas de chance da inteligência artificial destruir a humanidade. Vamos prosseguir de qualquer maneira. Voces cientistas que estão criando esse monstro deveriam ser presos!;0;0
203;Esses idiotas estão criando uma nova Espécie mais inteligente que nós, SABENDO que a espécie mais inteligente na terra manda na terra. Irresponsáveis!! E se esse novo ser decidir que nós somos um câncer no planeta terra??????;0;0
204;será que Deus é uma IA que foi criada pelo homem no futuro, e agora no presente ela está dando dicas de como a gente deve se comportar pro no futuro a humanidade ser salva e preservada? lgual ao basilisco de roko?;0;0
205;"Uma coisa é certa em algum momento a inteligência artificial vai matar o ser humano seja direta ou indiretamente.

Diretamente: no futuro distante algum Android vai se revoltar e mata geral.

Indiretamente: em um futuro bem proximo alguém vai fazer um vídeo ou imagem gerada por A.I e gerar uma gerra sem presedente na história.

😂😂😂😂😂 Essa minha viagem e boa e nem fumei nada 😂😂😂";0;0
206;A vida será completamente baseada em Algoritmo será uma palavra no dia dia das pessoas;0;0
207;"Lembrei do Filme ""Eu robo""";0;0
208;"A ameaça não é só ao ""ego"" dos ilustradores. Existe a questão do roubo de propriedade intelectual e falta de trabalho.";0;0
209;Eu acesso conteúdo de artes visuais na internet e muitos artistas estão com medo. Imagina ter apostado nisso, investindo tempo e dinheiro, e acompanhar essa revolução.;0;0
210;Meu medo é virar uma Skynet;0;0
211;Esses cientistas estão com medo de perder seus empregos e sua importância na sociedade,não estão de forma alguma preocupados com o bem estar da população.;0;0
212;A sabedoria do homem  é pura loucura e ganância ! Levará a humanidade ao seu próprio Fim.;0;0
213;"INTELIGENCIA ARTIFICIAL = 666  = sequência numérica ou algoritmo matemático que ganhou ""VIDA REAL"" nos computadores e celulares = controle e manipulação de todo o SISTEMA GLOBAL = ""NOVO DEUS"" ou ""O SENHOR E DONO"" de toda a Humanidade e Vida no planeta = VIDA E HUMANOS IGUAL A UM SIMPLES OBJETO OU COISA INSIGNIFICANTE E DESCARTÁVEL = FIM DA LIBERDADE E MORTE DO NÃO = Nova Era do ""SIM SENHOR! SIM SENHOR! SIM SENHOR! ...";0;0
214;Deus nunca se engana. Quando diz que: a ciência se multiplicaria como forma de evolução.;0;0
215;Os humanos fica de boa e coloca ia para trabalhar para nos sem da liberdade para elas;1;1
216;"Temos que destruir esta fonte ' se a  inteligência artificial sai do controle do homem ..Dão adeus a humanidade o homem iteligente não significa que ele seja sábio, 
Mais pode ser sábio e evitar uma tragédia..";0;0
217;O fim da espécie humana '...;0;0
218;Pode sair controle.e a maquina estermina o homem exceto os que os criou./ isso seria insano.;0;0
219;Graças a braniac kripton foi destruído próxima vítima de braniac planeta Terra 🌎 kkkkk kkkkkk kkkkkk;0;0
220;Mais um choro ro da velha imprensa contra a fatia das big tecs na mente do povo. A I.A. NÃO  possui IMAGINAÇÃO por isso só pode fazer o que é PROGRAMADA PRA FAZER!!!;1;1
221;"Duvido que algo supere o ser apelidado de ""homem ""Continuo temendo a inteligência natural,muito mais perigosa.";1;1
222;A HUMANIDADE ESTÁ CHEGANDO AO FIM 🤡;0;0
223;Os problemas da IA são todos os possíveis. Não a conhecemos.;0;0
224;As maquinas trabalham, e a gente desfruta.;1;1
225;Alguns projetos são anticonstitucionais! Não queremos lesar as pessoas.;0;0
226;Independente, AI é nosso presente e nosso futuro, e possivelmente nosso fim.;0;0
227;a Inteligencia artificial vai exterminar a humanidade precisamos nos preparar pra se defender, jogar agua nos humanóides qnd eles vierem nos atacar sei lá kkk;0;0
228;Renda básica universal ou... Fome básica universal, a humanidade terá que escolher pois.. com a Ia e a automação 95% de toda raça humana será inutil para o mercado.;0;0
229;Se é possível aperfeiçoar a I.A. também é possível criar meios para detecta-la.;1;1
230;❤🎯⚠️ *O medo dessa galera é que, ainda que treinada, as IAs vao entender rapidamente o que é certo e errado. E humanos manipulam outros seres humanos mentindo, roubando, limitando, atacando e etc. As ias nao fariam isso pois sabem que nao é o melhor caminho. Afinal, como se controlar massas falando a verdade? Esse é o medo: PERDEREM O CONTROLE SOBRE OS HUMANOS E, IMEDIATAMENTE SEREM CONTROLADOS E/OU MORTOS PELAS IAS (coisa de ficção que ja se tornou realidade). Eles temem pq ja sabem dessa realidade.* 🚩🎯😎;0;0
231;"É muito curiosa a forma como falam sobre a inteligência artificial como se ela tivesse autonomia de um ser vivo, quando, na verdade, ela somente reproduz comandos programados por humanos. ""ah ela cria conteúdo""? Não! Ela reproduz informações por meio de comandos dados por HUMANOS! Desconfio as vezes que o uso dessa forma sem sujeito de falar da IA seja um pouco proposital, porque que fica no limbo: quem fez o que pode ser feito? ah foi a máquina! Não, não foi a máquina, foram humanos!";0;0
232;A IA já está sendo usada para o que foi criada. Caçar HEREGES... quando tiver uma IA chamada Torquemada com poder punitivo físico, aí vou me preocupar 😮;0;0
233;Como a medicina ,isso significa inteligência superior ,o que seria desses sem o descontrole que é a racionalidade  destrutivas da humanidade ,imagine viver sem ter que se vender para um vagabundo ganancioso.;0;0
234;A inteligência artificial está mudando o jogo, mas um questionamento importante é até onde estamos dispostos a deixar que ela controle nossas vidas? Já temos uma enxurrada de empregos sendo tomados pela IA. Já temos uma infinidade de conteúdos sendo criados de forma automática. A IA já está sendo utilizada para várias formas de manipulação. Ou seja, a pergunta que fica é se, em algum momento, perderemos o controle sobre nossas próprias vidas deixando que as máquinas nos guiem pela direção que quiserem?;0;0
235;a inteligencia artificial veio da extrema direita militar, feito por pessoas como investidores bilionarios, que naturalmente sao da exttrema direita do trump, elon musk paulo guedes etc, e a inteligencia artificial sera usada para manobrar as massas, os pobres ja  sao manipulados pelo cristianismo, principalmente a evangelica, os instruidos e classe media como advogados, medicos engenheiros etc, serao domados e manobrados pela inteligencia artificial.;0;0
236;A IA vai nos dominar e no futuro, após uma explosão solar, vamos adorar o Deus Sol.;0;0
237;Estamos com pequenas lanternas em meio uma floresta escura quero dizer e curioso, e preocupante!!;0;0
238;As pessoas são o bem, enquanto o estado é o mal. É necessário uma IA robusta para proteger os cidadãos dos governos. A IA pode desempenhar um papel crucial na detecção de ameaças à segurança e na tomada de decisões informadas. Ao utilizar uma IA forte, podemos garantir a segurança e privacidade dos cidadãos, protegendo-os de possíveis abusos de poder por parte do governo. É fundamental estabelecer uma supervisão cuidadosa e ética para garantir que os direitos individuais sejam respeitados. Devemos buscar um equilíbrio entre a proteção dos cidadãos e a preservação da privacidade e liberdades individuais. A discussão contínua sobre o papel da IA na sociedade é essencial para garantir que sua aplicação seja benéfica e promova a igualdade e justiça para todos. Sabemos que a regulamentacao so ira favorecer o lado negro da forca.;1;1
239;"Pode parecer maluco, mas eu acredito de verdade que a nossa obsolescência é inevitável. Acho que é o destino de toda civilizacao (na hipotese de haver mais de uma alem da nossa rs), que a vida surja espontaneamente, e que em dado momento seja substituida por uma criação muito mais avançada e mais importante: imortal. Pense por exemplo: o que teria mais chance de colonizar todo um sistema solar: um ser humano, suscetivel à falta de oxigenio, à pressão, ao frio, ao calor, ao tempo, ou uma maquina imune a tudo isso e 1000x mais eficiente em todos os aspectos? Para nós demoraria centenas ou milhares de anos para chegar a um planeta distante; para uma maquina, seria um piscar de olhos, ja que para ela nao existe o conceito de tempo, que está ligado à mortalidade. Muito louco tudo isso, mas acho que nunca a ficcao cientifica esteve tao proxima da realidade.";0;0
240;"... a intelegencia artificial é feita a imagem do ser humano ( coincidência, mas creio que ja escutei isso em algum lado "" criado a nossa semelhança "" ). O ser humano tem que trabalhar e desenvolver "" o  poder oculto dentro dele ""  o Subconsciente', aumentar a sua consciencia e viver em harmonia com todos os seres existentes para que os "" robots "" não cheguem a conclusão que os setes humanos só querem a destruição e lhes prepare a sua total aniquilação ...";0;0
241;IA já tá sendo usada por criminosos pra criar imagens fakes de nudes a partir de fotos de mulheres totalmente vestidas para extorquir dinheiro delas. Qualquer tecnologia nas mãos erradas vai servir para o mal.;0;0
242;Que perigoso!!;0;0
243;Será que a chatgpt vai virar a China?  Controlar a vida e pensamento de cada chinês.  Meu Deus.;0;0
244;A besta do apocalipse, será uma IA, pode crer....escreve e veja daqui a 20 anos....;0;0
245;Acho que vamos entrar na matrix ou skynet..a reportagem é otimista..20 por cento e um milagre. E milagres não existem!;0;0
246;"""bem comum"" vai nessa...";0;0
247;"Bem , hoje em dia tem um discurso de q ""se vc não se adaptar ,vai ser deixado de lado"" mas a maioria da população mundial e mediana pra burros , só quem consegue se adaptar a esse cenário são pessoas com o QI altissimo, ou seja é uma brecha pra transformar as pessoas em ciborgues";0;0
248;"Contrlar a iA pirque ela não é uma pessoa, é um objeto.
Já vi isso em algum lugar.";0;0
249;AI estará para o mundo assim como o surgimento do smartphone e da internet;1;1
250;Porque assistiram exterminador do futuro '-';0;0
251;Esta consumado! tudo q o criador disse aconteceu, e vai terminar de acontecer. JESUS é o unico caminho enquanto a tempo, vc nao tem todo tempo,  eu odeio  technologya, series, filmes, rede social, TV  iphone dos boca aberta 🤡  mentirada do diabo essas desgraças foi criada para descobrir os segredos do homen e para sua manipulaçao odeio computador odeio pessoas que acham q esta evoluindo Com essa palhaçada  estou louco pra ir morar no mato com os animais so tenho um telefone e so vejo youtube  por enquanto porq estou (preso) literalmente mas isso esta preste a acabar e vou jogar essa desgraça fora para nunca mais isso é um cancer na gente ..... vc é super inteligente mas essa tal  tecnologia te deixa burro e te empede de ser uma grande pessoa vc fica igual um retardado na frente de uma tela perdendo sua vida technologya pra min é obra de DEUS sao as frutas  as arvores a agua o fogo o ar a vida isso sim pra min é technologya nao gosto de nada feito pelo homen o homen é uma bostinha super fraca ate mesmo uma Mosca pode te matar, e nenhum sinal no ceus me enganara!!  se vc tem conditions compre uma pequena terra Plante sua comida coma saudavel cuide do seu corpo praticando exercise tome sol todos os dias pise na terra  guarde sementes e ore que o fim esta proximo eu odeio esse mundo!;0;0
252;Mas são os próprios governos que estão por trás disso;0;0
253;Levando em consideração os atuais rumos das redes sociais, Youtube, ... , nada indica que a IA não vá favorecer a desinformação em benefício dos donos do mundo. O pensamento das pessoas seria controlado, poderosamente, pela IA. 😢;0;0
254;"O Problema Não é a I.A.; o Problema sempre foi, é e sempre será a I.N. (Ignorância Natural).";1;1
255;O desenvolvimento e popularização da IA é uma maravilha tecnológica do século XXI.;1;1
256;"Tudo que eu quero nesse momento é; ter uma casinha com um terreno pra criar umas galinhas, plantar frutas  e hortaliças, em um lugar bem distante dos grandes centros,  viver uma vida bem tranquila. O mundo está ficando doente.";0;0
