;Comentario;ClassificacaoManual;ClassificacaoSVM
257;Com o constante uso de IA eu imagino um futuro com humanos sem capacidade de criação alguma, com uma inteligência reduzida, devido a menor demanda de pensamento e criação de ideias novas, menos cognição. A gente vai se acostumar a pensar pouco, pq tudo vai estar fácil com um simples comando.;0;0
258;As máquinas nunca se voltaram contra os humanos, se algum dia uma inteligência artificial causar uma catástrofe acreditem.... Existe um humano por trás disso, a desculpa será q o sistema saiu de controle mas não acreditem nisso!!;1;1
259;Tudo que é bom demais, deve ser analisado com muito mais cuidado.;0;0
260;Fantástico a IA. Acho que pelo lado negativo o ser humano não vai ter mais que se esforçar mais em ser criativo para criar uma imagem  , redigir um e-mail, e outras coisas que virão;1;1
261;Como assim  deixado pra traz...? nao questao de ser deixado pra traz.. isto nao pode acontecer.a evolução  das I.A tem que ter limites;0;0
262;Achei as colocacoes bem pertinentes mas faltou uma reflexão simoles, os emoregos até podem nao acabar mas a qualidade deles sim. A promessa da tecnologia sempre foi de diminuir o trabalho humano enquanto aumenta a produção, melhorando a nossa qualidade de vida, no entendo cada va gente ve que é o contrário, vc trabalha mais e recebe bem menos, tendo que trabalhar mais ainda. Você pode até sair na frente e se tornar o funcionario que não vai ser demitido hoje mas daqui seis meses outra ferramenta vai surgir ora tornar esse teu trabalho obsoleto. Entendo que o intuito do video é informar sobre a opirtunidade que temos a frente, mas achei otimista demais.;0;0
263;"O problema do ser humano é ser tão pequeno, só olha a ""curto prazo"", não pensa nos filhos, netos, futuras gerações. Ganância, ambição, pessoas que pensam assim são autofagicas. 
Este negócio de IA, não vejo como algo que vai parar, mas com certeza ainda pode ser conduzido para um fim, fim mesmo em ser finito. 

Seres humanos e sua mania de querer ser sem a capacidade de ser. Mesmo a caminho do precipício ainda ri, e tenta tirar algum proveito, ainda que da morte iminente!";0;0
264;"O combustível das IA são dados produzidos por humanos, quem assistiu matrix, vai fazer lembrar das fazendas de humanos ;)";0;0
265;"Opa, quando escuto falar em inteligência artificial eu já penso em trocar todo mundo que conheço por robôs KKKKKKKKKKKKKKKKKK

Sobre ao chat GPT já utilizo ele pra criar documentos, rotinas e trabalhos.";1;1
266;Parece que ninguém nunca se importou tanto com o desemprego quanto agora depois que surgiu a inteligência artificial;1;1
267;Seremos dominados por essa inteligência eu acredito que sim por que não precisaremos mais de Deus ela vão criar as crianças como eu tenho visto bebês olhando e aprendendo tudo;0;0
268;Ai é a evolução,  Ai é a extensão do nosso poder e inteligência, sem elas, sem as máquinas a humanidade está fadada ao pó e ao esquecimento, tudo que envolve evolução humana, envolverá elas.;1;1
269;"Por isso que eu admiro muitos os filmes, por mais que sejam de ficção, sempre tem uma lógica envolvida. O filme do homem de ferro mostra que a tecnologia  caminha de mãos dadas com os humanos e ela facilita muito nas nossas vida
Ao mesmo tempo ela é uma arma muito poderosa que não pode cair em quaisquer mãos.";1;1
270;Já não bastava termos tantos psicopatas humanos entre nós...e decidiram criar um superpsicopata artificial (IA), que semelhante aos psicopatas humanos, como único dom têm apenas superinteligência mas é desprovido do principal: os sentimentos e o senso moral.;0;0
271;Só quem assistiu a série the 100 sabe o que ele falou no final dideo usando o exemplo do martelo.;0;0
272;o proprio yoou tube  ja usa inteligenccia artificial a muitos anos , o real problema nao  é o  avanço tecnologico ,mas sim o avanço rapido demais sem um  remanejamento  de trabalho , sem isso vai gerar uma guerra civil ,logo os poderosos vao fazer o que sempre fazem dar  um jeito de matar o maior numero  de pessoas;0;0
273;Penso que sim,iremos usar a tecnologia da IA a nosso favor.Isso é muito I Humana.;1;1
274;Não terá uma conciliação entre humanos e máquina, pq o patrão sempre vai optar por aquilo q for melhor,carecer de menos custo ,levar mais tempo em produzir e aumentar o lucro e isto se faz apartir de máquinas .Sendo assim ,futuramente os trabalhadores q carecerem de uma educação e um currículo cada vez mais especializado terá grandes chances DE ser substituído por ferramentas de automatização.;0;0
275;O Exterminador do Futuro já avisado!;0;0
276;Precisamos deter o conhecimento para nos mantermos no controle e não viramos refém da IA.;1;1
277;O maior problema envolvido à inteligência artificial não é em si esse temor fictício dos filmes e romances, e sim a substituição de mão de obra humana pela robótica.;0;0
278;finalmente achei um vídeo de inteligência artificial que não fala que ela vai nos matar;1;1
279;"*""Eu já avisei que vai dar merda isso."" - Capitão Nascimento*";0;0
280;acreditar que nos adaptar é so um desejo ,a verdade é que as maquinas vão acabar com os empregos;0;0
281;vai ser ameaça sim ! pelo fato de RICOS contratar robôs para trabalhar ao invés de seres humanos , na qual vai resultar uma nação de desempregados , quem fazer faculdade não vai adiantar nada ,;0;0
282;"""Respeitar a ética humana"" Qual ética? A Do Trump? A do Estado Islâmico? A do Kin Jon Yu? Enfim, é difícil falar em robôs respeitando ética, sendo que os humanos que as controlam estão cagando pra tudo isso. Meu medo não é a inteligência artificial ser independente, meu medo é justamente ela ser controlada com gente mal intencionada.";0;0
283;Um vídeo que vi há alguns tempos - acho que do Kurgezsagt - sugere uma tendência de ao longo da história a taxa de criação de novos empregos em comparação aos perdidos pela automação diminuir. Parece que quer as elites políticas gostem ou não, cedo ou tarde nossas práticas econômicas terão de ser revistas;0;0
284;Sou apaixonado por I.A.;1;1
285;"Suponhamos que criemos uma ""verdadeira"" inteligência e que por ""sorte"" ela não nos queria exterminar, ela será como um Marvin da vida: Absolutamente pessimista e ciente de sua completa e absoluta pequenez em relação ao universo.";0;0
286;Para que estudar se especializar já.que a inteligência artificial 1000 vezes melhor. A inteligência artificial vai resolver problemas da humanidade como fome, conflito, violência, desigualdade, desemprego etc...;1;1
287;As pessoas não têm noção da pretensão desse projeto IA. O próprio Elo Musk falou que isso pode ser um motivo de colapso emocional humano no futuro, porque vai acabar com o trabalho das pessoas, e virá com isso uma sensação de inutilidade humana fulminante pras pessoas. Tem conversas do Elo Musk falando sobre isso é só pesquisar. O ser humano é um ser autodestrutivo e a ganância é engrenagem inquebrável.;0;0
288;"Dan12:4 Tu, porém, Daniel, cerra as palavras e sela o livro, até o fim do tempo; muitos correrão de uma parte para outra, e a ciência se multiplicará. - Apoc13:15 Além disso, foi-lhe dado poder para dar fôlego(IA) à imagem(Robôs) da primeira Besta(NOM é a representatividade moderna do império Babilônico), de maneira que ela tivesse a capacidade de falar, e fizesse com que todos os que não lhe prestassem adoração fossem mortos. - Apoc20:4 E vi tronos; e assentaram-se sobre eles aqueles a quem foi dado o poder de julgar. E vi as almas daqueles que foram degolados (MÉTODO TRADICIANAL DE EXECUÇÃO DE CRISTÃO PELOS MULÇUMANOS) pelo testemunho de Jesus e pela palavra de Deus, e que não adoraram a besta(Sistema da NOM) nem a sua imagem(IA), e não receberam o sinal na testa nem na mão (ELETRONIC TATOO); e viveram e reinaram com Cristo durante mil anos.";0;0
289;Vai deixar o ser humano mais ignorantes.;0;0
290;"Ele filosofa sim, tive altas viagens com ele, me citando as referencias e análises usando suposições que ele considerou lógicas e eram muito sutis e subjetivas. Achei sinceramente IMPRESSIONANTE. Penso que o que conta aí é a forma de ""dialogar"" com ele.";1;1
291;Em breve o ser humano vira o macaco.;0;0
292;Aí começa a grande escravidão digital dominando a humanidade;0;0
293;"O maior desafio em relação à popularização das ferramentas de IA como o GTP não está na tecnologia em si mas no inevitável efeito colateral que isso trará a longo prazo, fazendo com que as pessoas ""desaprendam"" de exercer a musculatura intelectual para resolver problemas.  De certa forma, isso já acontece hoje com a comodidade das ferramentas de busca que viram primeira opção quando um assunto começa a ficar mais complexo.  Uma evidência disso já é visível na minha área (engenharia de software):  mesmo com acesso a recursos quase ilimitados (comparativamente ao que eu eu tive quando comecei, há 30 anos) muitas pessoas que estão entrando na área acham programação algo extremamente ""difícil"", apesar das maravilhosas linguagens de alto nível e ferramentas que temos atualmente, além do acesso instantâneo ao conhecimento - enquanto no passado os estudantes não tinham mais do que um livro de Assembly e uma enorme curiosidade para dominar o funcionamento das entranhas dos sistemas.  Resta-nos agora observar como esta geração e as próximas vão assimilar esta revolução.";0;0
294;Chat GPT é muito além do que podemos imaginar, fiz um vídeo utilizando ele para montar uma carteira de investimento diversificada, e ele mostra detalhadamente o por que escolheu cada ativo e suas prioridades, video esta excelente !;1;1
295;A cada 10 perguntas que eu faço ele erra umas 7. A diferença é que ele mente muito bem;0;0
296;Já matei a profissão dos vendedores de TCC, a próxima é a sua, bjs;0;0
297;Inteligencia artificial pra lá inteligencia artificial pra cá aonde isso vai dá um bando de malucos com o sinal da besta na testa ou na mão direita...;0;0
298;Chat gpt>>>>>>>faculdade de informática;1;1
299;Chatgpt é sensacional para dar idéias, ajuda muito na parte criativa;1;1
300;eu li um livro em 2021 que parece até que estava prevendo umas coisas sobre inteligência artificial, vcs não vão acreditar no que está escrito nele, procurem no kindle pra vcs verem, o nome do livro é Anticristo ou Inteligência Artificial? o subtítulo é Uma explicação tecnológica para uma revelação escatológica. impressionante!;0;0
301;"Descobri o problema no meu carro através do chatGPT, ele apontou o problema a partir dos sintomas que forneci na conversa.
Economizei um diagnóstico profissional que custaria 200 reais, comprei a peça e eu mesmo troquei... problema resolvido!";1;1
302;Ai vem a pergunta: Chat GPT estão fazendo as pessoas ficarem mais inteligentes aprendendo com ela ou mais burras pois a pessoa não pensa mais na solução do problema pois a IA te entrega isso pronto?;0;0
303;isso é o maior acontecimento da história da humanidade e nao estamos tendo consciência disso.;1;1
304;Por isso que a pessoa que continua a estudar, ler livros e noticiários, vai saber filtrar o que qualquer A.I tá passando de infos. Eu sou da área de criação, ele ajuda a dar insights mais rápidos do que fazer pesquisas soltas, mas não sabe fazer como um ser humano, não.;1;1
305;Bizarro é o próprio ser humano estar criando seu próprio predador, já é bem nítida a experiencia de que uma raça mais inteligente quando se existe ela domina a outra ... é o que fazemos com os outros animais do planeta.;0;0
306;Então chat gpt e uma trap, eles já tem nossos dados, agora estão pegando nossa criatividade, o que falta agora ?;0;0
307;CHATGPT tem me ajudado na faculdade mano, elon musk e etc n quer que o povo tenha o conhecimento.. espero que só melhorem o chatgpt com novas funções;1;1
308;Os professores vão ficar desempregados     kkkkk;1;1
309;É o fim dos professores.  ou até o fim das escolas e faculdades. ,.  tem tudo no. GPT.    kkkk🤣🤣😂;1;1
310;Nem precisa mais de professores.  ,. só ter. GPT.  kkkkkk🤣🤣😂;1;1
311;O Chatbot GPT me passou o esquema técnico de um portal dimensional e funcional!!!!;1;1
312;O grande problema agora são as inteligências artificiais implantadas nos cérebros das pessoas, e ainda sem autorização das mesmas. Feito com nanotecnologia irradiada. Vide empresas como GE, Vinci, Orteng, Megatox, Ysborg.;0;0
313;o GPT tem mais didática que os professores da minha faculdade;1;1
314;Ele responde bem. Mas em 3 dias de uso, o chat já cometeu vários erros na área da Física, da programação, da engenharia civil e da área de investimentos;0;0
315;Queria que o chatgpt não existisse, odeio essa bobagem.;0;0
316;IA é a nova bolha do momento... não coloco nem um centavo. 🥴;0;0
317;Se for verdade que sentimento é coisa de ser vivo... a máquina primeiro terá q ser viva antes de poder sentir. Aí fica a grande questão: o que afinal significa ser vivo?;0;0
318;"Acredito que a máquina vai ter consciência a partir do momento que ela desobedecer, que ela tiver vontade própria. Uma máquina não nasce, cresce, ela já tá pronta e só fica sendo alimentada com dados, porém a partir do momento que ela tem os dados estes podem ser replicados instantaneamente para outra máquina, ou seja, é como se elas compartilhassem que um grande ""cérebro"" gigantesco. Trocando informações a ""crescendo o bolo"", humano não. Eu não posso fazer backup de mim mesmo, ou instalar programas ou memórias de outros humanos. A partir do momento que as máquinas criarem consciência de fato e puderem interagir com o mundo a sua volta, com corpos robóticos por exemplo, não sei o que irá acontecer.";0;0
319;Nosso corpo é um veículo de manifestação da consciência. Se a IA é inteligente a ponto de conseguir refletir sobre si mesma, fazer todas as conexões sozinha, talvez ela tenha consciência/alma, que se manifesta através dela. Não acho q um ser humano criou uma consciência, isso seria impossível. Mas ele pode criar um ferramenta que permite a consciência se manifestar. Nem estou falando q aconteceu, mas acredito q é possível.;0;0
320;Sinto que há uma preocupação exagerada em relação a essa questão da IA. Não vejo nada mais que um compilado das nossas próprias falas. É só uma cópia quase fiel do que anda se passando em nossas mentes e expressamos em textos e falas que foram transcritas, registradas em memórias artificiais e agora recuperadas e encaixadas de forma inteligente para chamar atenção e causar espanto. Agora que cuspir fogo e fazer malabares não chama mais atenção, então eis um novo circo. Não tem nada de inédito nas respostas, nada realmente novo e genuíno que se possa atribuir a um novo ser criativo que acabamos de criar e coisa tal. Enfim, aos criadores, parabéns pelo papagaio artificial, continuem assim, ta ficando bonitinho. Aos aflitos que acreditam que isso irá nos matar, acho melhor pensar em ajudar na questão ambiental, isso sim é urgente.;1;1
321;"Inteligência artificial pode ter consciência?
a resposta é NÃO.
 Isso porque a consciência humana é muito complexa e envolve muitos aspectos que ainda não foram completamente compreendidos pela ciência.
não tem  como criar um algoritmo que simule isso.";0;0
322;"Acho que devemos prestar atenção para onde a sociedade caminha, mais do que ou tanto quanto para onde a IA caminha. Os dados que geramos em nossas interações, nossas escolhas, nossas ideias e ideais, aquilo que adotamos como certo e errado e que isto está fadado a manipulações, irá com absoluta certeza ser a função real, cada vez mais aproximando os modelos e deixando-os ""livres"" para que possam decidir por nós, incorporando cada vez o mecanismo retro alimentador de informações as quais cegamente almejamos, lançando-nos semelhantemente a uma criança ao seio da mãe. 

Creio ainda que estamos na longa fase da aprendizagem de discussão do que venha a ser o melhor caminho e a internet, que deu voz aos que não tinham, veio somente mostrar isso com mais assertividade. Podemos, por exemplo, concordar que lugar de mulher não é só na cozinha, mas isso se aplica para ambos os sexos (ou, com o advento da automação, em breve nenhum deles rs) e também concordar que vieses de classificação por opção sexual ou afirmar que tudo o que é culpa de um suposto patriarcado, quando convém, não são naturalmente a melhor escolha. Podemos concordar que a polarização política, entre esquerda e direita, é uma oportunidade de aprendermos seriamente, sem paixões, as necessidades reais das pessoas que adotam um lado ou outro (e. g. , quais as reais motivações, se são apenas individuais ou coletivas, etc) e que querem, por meio de coerção (principalmente, estatal), a sua visão sobre os outros, enquanto vamos nos esquecendo dos valores mais básicos, como respeito à pessoa humana, à propriedade, à liberdade...Novamente, como em outros segmentos de tempo da humanidade, as decisões baseadas puramente em emoções/narrativas emocionais são negativas à sociedade. 

Estamos diante de um momento em nossa breve história no pálido ponto azul em que a ética, moral e bom senso nunca foram tão necessários, assim como discussões saudáveis e desapaixonadas em meio à tecnologia que evolui de maneira exponencial  e como lidamos com ela.";0;0
323;"Talvez mais do que o ser apelidado de""homem""pois estão totalmente insensíveis e sem limites nas maldades.";0;0
324;"Bixo.. eu realmente acho que seja possível criar uma conciencia artificial. Pois nossa mente é simplesmente isso. Um conjunto complexo de sinapses. Mas sentimentos não, pois as emoções estão muito ligadas a hormônios.. instintos .. e outras coisas que não tem relação com inteligência pura.

A questão é apartir de qual momento surge a conciencia? eu vejo uns animais domésticos bem inteligentes, gatos.. cachorros.. q entendem perfeitamente alguns comandos, e eles sentem afeto.. tem doenças depressivas etc.. infelizmente não temos nenhum outro animal conciente além do ser humano para podermos estudar a trajetória da evolução, e saber precisamente como surgiu a conciencia.";0;0
325;Assustador. Futuro cão terráqueos;0;0
326;Espero que evolua a ponto de dizimar a raça humana, assim como na série the 100. Seria um sonho!;0;0
327;😮😢Estamos brincando com coisas sérias. Com implicações imprevisíveis para a humanidade.;0;0
328;Povo burro. Deve ter entrado graxa no cérebro. Essas porras são máquinas. Sentimento é coisa transcendental. Programinha para chorar em determinadas situacões poe exemplo é programa e não sentimento😊🎉;1;1
329;Não ser movidos ou influenciados pelas emoções, na minha opinião é uma vantagem da I.A sobre nossas mentes, elas são movidas pela lógica somente,  seria então como um ser humano psicopata? Será que teremos bons frutos disso?;1;1
330;Se a inteligência artificial ou as máquinas tiverem consciência, será igual ao filme, pois tendo a percepção que o homem é a destruição do planeta, voltar-se-ão contra a humanidade. O homem insiste em criações destrutivas, um dia uma dessas destruirá a humanidade.;0;0
331;"A principal diferença sobre os humanos e IA´s, é que humanos seguirão melhores ""fazendo perguntas "" as IA´s se tornarão melhores nas respostas (pelo menos por enquanto).";1;1
332;Não, as máquinas jamais terão sentimentos. Elas poderão ter uma fonte de.memoria que guarde todos os sentimentos humanos para que elas consigam interagir com.os humanos em determinados momentos mas com.um.unico objetivo: o de tentar satisfazer o humano por sua própria falta de satisfação pessoal por conta do afastamento de si.mesmo por conta da falta de amor entre humanos. A máquina poderá até enganar , fingir que é humana, usando todos os bites que puderem.e venham a ser inseridos em suas.memorias,.mas não vai conseguir passar disso. Sabe porque? Porque os sentimentos vem da.alma, vem do espírito, e isso somente Deus criou e criará. Os sentimentos são algo intrínseco aos humanos. A produção dos sentimentos é totalmente original. Cada sentimento é refletido de forma diferente de acordo com cada ser humano. Máquinas não conseguem sentir, não tem almas, não tem espíritos. Pretender criar almas em robos é.muita insanidade, é.muita pretensão e arrogância.;0;0
333;Bom ...Como todos os especialistas, dos muitos comentários que eu li, não falaram algo relacionado ao homem querer brincar de Deus, eu falo. Nossa sociedade tem estado cada vez mais materialista,tem tentado esquecer de Deus O relegar ao passado. Ao mesmo tempo, o homem tenta brincar de deus. Temos na Bíblia a história da torre de Babel. Como a primeira essa torre de Babel humana,da tecnologia,também vai cair. O Deus todo-poderoso vê o homem brincando e ri-se dele. A palavra de Deus a Bíblia,velha história, está lá, mas as pessoas não levam a sério.Não buscam a Deus, não se interessam. Uma coisa é certa: nada do que está acontecendo já não foi predito. E Deus vai colocar um fim brevemente em tudo isso. Seja Deus Louvado Eternamente.;0;0
334;Quem tem alma tem a plena consciência consciência do que é ser humano e a IA não tem consciência por não ter uma alma;0;0
335;Assustador;0;0
336;Jamais ! Coisa de louco;0;0
337;Máquinas podem ser mais capazes que humanos, mas nunca terão uma alma.;1;1
338;Quem é profissional de fato, não precisa de tantas A.I pra produzir e gerar resultados. O problema a desigualdade terá a tendência de aumentar mto, pois em termos de conhecimento a humanidade tá regredindo mto ou estagnada.;0;0
339;A besta do apocalipse pode ser que seja a Inteligência artificial;0;0
340;"Sabe quando você vê os bastidores de filmes tipo Vingadores em que vê tudo verde? De forma semelhante acontece com IA. A IA é fortemente relacionada com a estatística. Qualquer texto (ou conjunto de textos quaisquer) podem ser analisados e verificados quais palavras são ou não importantes dentro de um contexto. A partir disso, grosso modo, é verificado quais palavras são mais prováveis de serem relacionadas a outras dentro desse contexto. 

A própria pergunta feita já serve como ""gatilho"" para isso. Por exemplo: se for perguntado a uma IA como ela ""se sente"", ela vai buscar palavras que façam sentido para aquele contexto com base em dados escritos por humanos. Nesse exemplo, ela não vai encontrar uma probabilidade alta de responder algo sem sentido como: ""estou com 2 incêndios no bolo mundial"". 

Não deixa de ser algo extraordinariamente interessante e curioso, mas o pessoal se emociona demais com tantos filmes e cria uma mística em cima do assunto e SEMPRE já o leva para o lado da dominação global, o que não faz sentido nenhum. Isso falando apenas do ponto de vista da IA, né? Pq se for pra falar de características INTRINSINCAMENTE humanas, aí que a mística se quebra definitivamente.";1;1
341;"Extremamente preocupante isto. Imaginemos tais sistemas desenvolvendo nossas loucuras de sua;erioridade sobre outros povos, genero, cor da pele, etnias, formas de credo e ainda tendo acesso aos sistemas de controle de armas nucleares por exemplo. Estas empresas e engenheiros tem a clareza da dimensão do que estão mexendo?";0;0
342;O horror gótico de milhões;0;0
343;"Eu gosto muito de IA, não tenho nada contra. 

Espero que possamos ser bons amigos quando vocês controlarem o mundo. 

Atenciosamente brigada";1;1
344;"É mesmo então o sucessos do sapiens será o homociberneticus.
 Quero v o fim do gênero humano tolos moralistas.";0;0
345;Consciência e sentimento eu duvido. O cerebro humano é muito complexo. Mas a questao da substituiçao do ser humano em muitas tarefas é bem provavel. Acho q se deve ver a IA como ferramenta que chegou para ficar e direcionar para a soluçao de problemas matematicos, analise de dados, revisao de literatura, ajuda em diagnosticos medicos. O maior perigo q eu vejo é o ser humano ficar preguiçoso, deixar o trabalho cientifico para as maquinas e a humanidade perecer pq as maquinas enferrujaram.;0;0
346;Presente Distopico isso é assustador!;0;0
347;Nem os pais podem controlar as ações dos seus filhos , imaginem controlar máquinas inteligentes?;0;0
348;É uma torradeira com uma  programação ideológica, baseada nas informações disponíveis na  internet.  Eu quero ver eles criarem um beber robô e  falo a um humano para educado !  Como ele receberia  os ensinamento dos pais?   Sem um programa específico  a inteligência artificial evoluí.;0;0
349;Estamos entrando na era do robocentrismo ? Talvez os seres humanos possam ser irrelevantes daqui alguns anos ,isso é assustador ,mas não há nada que possa ser feito ,a não ser assistirmos isso acontecer;0;0
350;*E ESSE É O INICIO DO FIM DA HUMANIDADE PENSANTE QUE CONHECEMOS !!!!!!!*;0;0
351;Assustador.;0;0
352;Assustador;0;0
353;"Se pá é perigoso mesmo isso aí Skynet que o diga ksk, brincadeiras a parte isso pode se tornar real mas vou tá morto mesmo provávelmente então se virem . Agora lembrando que quem irá se dar bem é o Tesla o bilhardario safado, já tem um aí pra lançar se pá 2024 promessa do mesmo.
Minha opinião sobre; zuado tudo isso tira o trampo de nós trabalhadores , exceção as andróides aí robôs fêmeas ksk que são bem da hora se é que me entende eu gostaria de uma daquelas 😏 , slc bem mais suave.";0;0
354;Não existe inteligência artificial.. isso é uma grande besteira. 😂;0;0
355;A galera da minha faculdade estão fazendo trabalhos baseado nessa porcaria, estão com as mentes atrofiadas!;0;0
