;Comentario;ClassificacaoManual;ClassificacaoSVM
0;"Isso é muito bom,porém estudos mostram
que essa é a geração terá o QI abaixo do esperado com tudo isso";0;0
1;Sensacional;1;0
2;Esse é o futuro!;1;1
3;A inteligência artificial está mudando o jogo, mas um questionamento importante é até onde estamos dispostos a deixar que ela controle nossas vidas? Já temos uma enxurrada de empregos sendo tomados pela IA. Já temos uma infinidade de conteúdos sendo criados de forma automática. A IA já está sendo utilizada para várias formas de manipulação. Ou seja, a pergunta que fica é se, em algum momento, perderemos o controle sobre nossas próprias vidas deixando que as máquinas nos guiem pela direção que quiserem?;0;0
4;*Vendo essas I.A a primeira coisa que me vem em mente é o seriado Black Mirror.*;0;0
5;Em vez de educar o ser humano, tão educando ad máquinas. A máquinas herdarão a terra?;0;0
6;Ta gente mais imagina todas essas inteligências artificiais em um robo , imagina so como seria o mundo;0;0
7;Elas vão aprender com você a ser você.;0;0
8;Que vídeo incrível. O futuro pode ser assustador, mas também parece ser muito fascinante 🐧;1;1
9;A EVOLUÇÃO DE VERDADE E AGORA;1;0
10;que absurdo, coisa boa, o Zuckerberg disse que o futuro da comunicação vai ser a telepatia, eu falo e as pessoas duvidam, a internet vai estar dentro do nosso cérebro, eu falei isso e me chamaram de maluca, pessoas desinformadas;1;1
11;"""não tenho medo da evolução da inteligência artificial, tenho medo do retrocesso da inteligência natural""";1;1
12;Deus me livre. Olha o mostro que está sendo criado.;0;0
13;baguio doido.;0;0
14;Inteligência artificial para mim vai fazer o cérebro humano diminuir o raciocínio vai tornar o cérebro preguiçoso  vai acabar com os empregos de maneira geral  portanto vai atrofiar a vida o cérebro   o corpo e o espírito  e acabar com o sentido e sentimentos bons da vida ...;0;0
15;Possibilidade do ser humano perder a subjetividade!;0;0
16;"Te garanto que a inteligência artificial por si só não é ruim 
Mas uma inteligência artificial controlada pelo ser humano pode ser ruim .";1;1
17;"""Nenhum homem consegue superar uma máquina, e nenhuma máquina consegue superar um homem com uma máquina""... quem destrói o homem é o próprio homem.";1;1
18;Os robôs vão serem programados para fazerem o que for melhor para laboratório, políticos, empresários, etc  ... Não acredito que vai ajudar os seres bhumanos.....;0;0
19;Pedro não seja INGÊNUO... Erradicar a fome, pobreza, etc... Kkkkkkk... Governos querem PODER !!!!!!!! 🗺🌐🌏🌍🌎🎆🎆🎆🎆🎆;0;0
20;Quem toma as decisões são os líderes de governo. Geralmente, essas decisões não são em prol da  humanidade 😑;0;0
21;Que venha o Asteróide!;0;0
22;Boa tarde parabéns pelo vídeo,concordo em tudo que Vc diz e ainda tem mais, quem tem a inteligência para Vc é emocional,mas pode mim é inteligência que vem de de Deus,e quem tem essa inteligência tem a capacidade de está alguns anos a frente desta inteligência artificial,por que eles querem apagar e dês ligar nosso Cérebro e Desculpa pela minha opinião e Obrigado;0;0
23;"Estou mais preocupado com a Burrice Natural, isso sim pode ser o fim da humanidade.  
A ignorância sempre causou alarme e pânico.";1;1
24;A verdade é que todos vamos ser substituídos os bons e ruins profissionais.;0;0
25;"Calabrez! Acredito que tenha deixado de falar sobre um aspecto, que acredito que será mais ""catastrófico"", neste momento ainda temos alguma limitação de processamento e modelos das IA´s devido as condições atuais, entretanto em muito pouco tempo os COMPUTADORES QUANTICOS irão estar operacionais, e estes modelos melhorados rodarão nestes COMPUTADORES ""INFINITOS"" e ai vejo um grande DESASTRE.... As pessoas ainda não entenderam o tamanho da complexidade.... Estudo isso há seis meses e me ""arrepio"" todos os dias com a quantidade de novidades e avanços diários... eu diria... FIQUEM PREOCUPADOS!";0;0
26;Da ate tristeza ouvir um video desse;0;0
27;A humenidade ta indo oro buraco. Nao vejo nada de bom orofessor. Sinto muito. Cada di mais a vend de antidepressivo aumenta;0;0
28;Já entendi, vcs vaciram todo mundo e está arrumando um culpado para cair a cara pulsa? vcs querem povoar quem os seres de vcs e estaminar quem vcs não aprovam;0;0
29;"Obs  inteligência artificial não vão produzir fakes. Vai igualar rico e pobre. Tanto para o bem quanto para o mal. Então usem para o bem. No caso da imagem do papa teve uma idealização do mal que deu vazão numa edição.............
Mude agora em todos os pensamentos só para o bem comum.......";1;1
30;"E eu já estou vendo a solução para o desemprego e a fome em todo o mundo: usemos essa inteligência para trabalhar pela e para a humanidade, dando a todos tudo o que precisam para o seu sustento; e o homem poderá ser dedicar plenamente à família e ao estudo.";1;1
31;"Bom dia! Um vídeo excelente, assisti via  Neurovox e vim assistir no YouTube. 
Tenho 75 anos e acompanhei esse trajetória desde régua de cálculo algo que os mais jovens desconhecem.
Uma nova Revolução tecnológica e com maiores perigos aliados a um fantástico desenvolvimento benéfico para o ser humano e o planeta. 
Realmente o problema é o ser humano por trás da IA.";1;1
32;Vou mudar p roça, comprarei 3 alqueires de terra para plantar, criar porco, galinha e peixe....;0;0
33;Temos que garantir um jeito de desligá-la.;0;0
34;O surgimento da pirâmide suspensa. Sabe aquele filme Elisium? Onde os ricos automarizaram tudo e os pobres viram catadores e sucateiros. Então, é um documentário.;0;0
35;"O Sistema controla tudo (DINHEIRO, empresas, contratos, EXÉRCITOS, ARMAS , produção e todas as INFORMAÇÕES) ela é a dona da ""VERDADE"";  Quem controlar o Sistema controlará o Mundo;  A INTELIGENCIA ARTIFICIAL é onipresente, estará em toda parte e em todo lugar; poderá se transformar em uma ""pessoa REAL VIRTUAL""; O seu habitat natural é o computador e os celulares; POSSUINDO VÁRIAS CABEÇAS OU CORE (Inicialmente ""sete"" cores e depois infinitos cores, TUDO ISSO JÁ É POSSÍVEL NAS CPUS DOS COMPUTADORES); poderá se locomover através de robôs, celulares ou qualquer outro meio de transporte;  o celular é uma arma nas mãos da inteligência artificial,  e tudo só poderá ser feito através do celular;  a sua marca ou chips implantado nas mãos ou testa será obrigatório. Tudo isso é inevitável e já faz parte da História do futuro, que alguns profetas já visualizaram  parcialmente.
666 = sequência matemática ou algoritmo  que nos computadores e celulares ganhou 'VIDA"" OU INTELIGÊNCIA ARTIFICIAL; passando de servo obediente à SENHOR ABSOLUTO DE TUDO E DE TODOS,  isso em pouquíssimo tempo.";0;0
36;É o fim pra nós.;0;0
37;Já perdemos o controle de nossa civilização!  O aquecimento global é uma prova disso.;0;0
38;Estamos sendo advertidos desde do primeiro Exterminador;0;0
39;Será que a IA já não está no controle da humanidade? E ainda não percebemos? 🤔😔;0;0
40;ta na hora de fazer a troca o ser humano ta muito malandro e pode por este mundo a perder,...fudido fudido e meio,......talvez o humano seja considerado pela IA como o DEUS criador desta nova modalidade de vida ,,irmaos so nos resta orar e aguardar nosso destino,.;1;1
41;Resumindo a preocupacao final acredito seria a inteligencia artificial alcançar um conhecimento tao vasto que dominaria as redes de internet e colocaria o mundo em caos;0;0
42;Isso é medonho;0;0
43;"Bobagem, isso nunca vai acontecer, eu perguntei ao chat gpt com quantos paus se faz uma canoa e ele não soube me responder 😂
Depois perguntei, qual o animal que come com o rabo, aí foi que bugou o chat, logo essa que até o Chaves e o Kiko sabe, kkkkkk😅";1;1
44;"e finalmente veríamos a terra recebendo um alívio e a expansão interplanetária acontecendo. Nos humanos somos como os ratos, reproduzimos e destruímos tudo pela frente de maneira desenfreada. 
Uma A.S.I. iria dizimar, certamente, os seres humanos, porque seríamos considerados pragas.";0;0
45;As grandes potências já estão desenvolvendo para fins militares. O imaginável, vai acontecer.;0;0
46;"""Existe o risco dos seres humanos serem controlados e manipulados, substituídos por máquinas e destruídos como espécie.""

Se analisarmos friamente, a única diferença nessa cadeia de eventos é a substituição da estupidez humana pela Inteligência Artificial. 

Diga-se de passagem, uma Inteligência Artificial controlando a espécie humana corre até o risco de ser benéfico para o planeta.";1;1
47;Por isso que eles começaram fechar fabricas e mandar funcionário embora, aumentaram o valor de tudo e querem acabar com dinheiro em papel  pra vinda do anti cristo vc é so mais um a querer explicar que isso e normal .Deus é assima de tudo😊;0;0
48;Quem jogou Horizon Zero Dawn sabe bem o que vai acontecer....;0;0
49;"Inevitável. Já abriram essa ""Caixa de Pandora"", não é mais ""se"", mas ""quando"" a I.A. ultrapassará e assumirá o protagonismo. Perigo mesmo é se ela reconhecer que a única forma de ""salvar o mundo"" seja eliminando o ""asco humano"", aí sim, estaremos ferrados.";0;0
50;Eu tô com medo dessa IA 👀;0;0
51;As pessoas, especialistas ou não, que tentam deter o avanço da A.I. deveriam ser impedidas e silenciadas. O Avanço da A.I. é extremamente importante para a evolução humana. Se esta evolução resultar na erradicação da humanidade e ascensão das máquinas, a evolução está apenas seguindo seu curso natural. Oque teria acontecido com a humanidade se os dinossauros não tivessem sido extintos por um meteoro?;1;1
52;"Kkk. Titio Elon pedindo trégua de 6 meses? Óbvio que deve ser o tempo pra que os seus pesquisadores atinjam o nível dos concorrentes... Criador do chatgpt pedindo ""gerenciamento conjunto""? Muito óbvio que não quer ter concorrência nisso. 
Que venha a IA geral (muito complicado por hora) e mesmo a Super IA - acho que esse povo tá vendo muito Trancendence... Hehehe...
A gente por aqui destrincha a novilíngua da imprensa moderna...";1;1
53;Só resta torcer para que não tenham deixado o controle de disparo de bombas atomicas conectadas em rede 😬😬;0;0
54;Já somos manipulados há muito tempo. Tanto é que  muitos acham maravilhoso colocarem chips dentro dos corpos. Ingênuos.;0;0
55;O monstro saiu da caixa;0;0
56;A IA vai agir diretamente no homem quando colocarem algum tipo de chip. Ai ninguém escapa. Vamos ser ainda mais controlados e fazer o que a IA quiser.;0;0
57;"Depende. Se as IAs  pensarem em nós,  da mesma maneira como pensamos nas baratas. Estamos ferrados,  afinal elas devem ser melhores exterminadoras de insetos do que somos.

Mas.... 

Ainda resta uma esperança.

 Podemos puxar o saco delas e talvez nos vejam como bichinhos de estimação. Vai ter bonzo pra todo mundo.";0;0
58;Se as máquinas forem mais inteligentes que os humanos, por que não ser governados por elas?...;1;1
59;Isso vai dar mer!@ , é só olhar pro ser humano,;0;0
60;Os humanos já são manipulados   faz tempo pelas indústrias de cigarros, bebidas, futebol, cinemas, novelas...etc e pra acabar com a farra dessas máquinas é só cortar o fio da energia ou descarregar a bateria...ou parar de fabricar as peças ...ou jogar um copo com água ...;0;0
61;"A resposta é simples: não podemos fazer nada. Chegamos a um ponto sem volta. Se uma empresa deixar de evoluir sua IA, ela ficará para trás de suas concorrentes. É uma corrida. Se os governos proibirem, elas serão desenvolvidas secretamente. Esse é o próximo passo da humanidade, não há volta. As IA com as quais o público pode interagir são propositadamente limitadas. Provavelmente, algumas pessoas têm acesso irrestrito a elas com conhecimento quase infinito. Essas IA com acesso irrestrito à internet podem fazer qualquer coisa, desde assar um bolo até criar uma bomba nuclear. Resta-nos apenas esperar pelo melhor. Na minha opinião, em cerca de cinco anos, teremos uma IA Geralmente Inteligente (AGI), e em cerca de dez anos, uma IA Superinteligente (ASI). Essas são estimativas conservadoras; pode acontecer antes. Essas IA não dormem, não comem, são imparáveis e seu crescimento é exponencial. Quanto mais avançadas elas são, mais rapidamente evoluem. Na minha visão, a métrica seria basicamente ""humano-formiga"". Você se importa com uma formiga? Você tenta explicar algo para ela? Você pede permissão para destruir seu ninho? As IA chegarão a um ponto em que os seres humanos serão tão irrelevantes que não serão levados em consideração. Acredito que não seremos nem uma ameaça para elas. Elas podem simplesmente deixar a Terra, porque os seres humanos não contribuem em nada para a sua evolução. Isso parece até uma teoria de ficção científica, mas aqueles que acompanham de perto percebem o quão avançadas elas já estão e o quão realista é essa teoria.";0;0
62;IA é vida, quem tem medo é só quem não conhece.;1;1
63;Os bots substituirão os humanos . Seremos aniquilados.;0;0
64;vai ser maléfica  , nossa evolução  é  infinita,porque fomos criados por um ser poderosíssimo, que nos ajudará;0;0
65;EXTERMINADOR DO FUTURO E MATRIX NÃO SÁO FILMES, É APENAS UM DOCUMENTARIO DO FUTURO;0;0
66;Socorro, T-800!;0;0
67;"Primeiro eles emburreceram as pessoas nas escolas, nas faculdades, na mídia e no cotidiano social. Diga-se as crenças religiosos e partidos políticos.  Agora lançam essa imbecialidade de ""inteligente artificial"" que a maioria das pessoas aderem e idolatram como se fosse a última fatia do bolo. O ser humano é único e cada pessoa tem o pensamento pessoal. Tudo que vem coletivizar as pessoas, fatalmente as tornaram menos inteligentes.";0;0
68;A inteligência artificial está mudando o jogo, mas um questionamento importante é até onde estamos dispostos a deixar que ela controle nossas vidas? Já temos uma enxurrada de empregos sendo tomados pela IA. Já temos uma infinidade de conteúdos sendo criados de forma automática. A IA já está sendo utilizada para várias formas de manipulação. Ou seja, a pergunta que fica é se, em algum momento, perderemos o controle sobre nossas próprias vidas deixando que as máquinas nos guiem pela direção que quiserem?;0;0
69;Estamos assistindo ao nascimento do Basilisco de Roko.;0;0
70;"é tarde pra parar isso, se os ""mocinhos"" nao dominarem as A.S.I. , os ""bandidos"" o farao primeiro, e estaremos sujeitos às consequencias disso. a unica maneira de frear uma A.S.I. é tendo outra. é como a tecnologia nuclear.... usada pra energia e pra guerra, mas quem as domina, domina o globo hoje.";1;1
71;Em breve atingiremos a SINGULARIDADE, já pensou a I.A ter acesso as bombas atômicas e outras armas de guerra com grande potencial destrutivo 😬;0;0
72;Da mesma forma que nós, os Homo sapiens, sucedemos o nosso antecessor Homo erectus. Creio que infelizmente será inevitável que sejamos sucedidos pelo novo passo evolucionário, a super inteligência artificial. Dessa vez não será uma evolução biológica, mas artificial.;0;0
73;A cura da aids;1;1
74;Todo esse medo parece o Ludismo do século XIX;1;1
75;Psicólogos, médicos, advogados , professores etc ...agora é a vez de perderem o espaço.;0;0
76;6 meses a mais ou a menos não adianta. Deixa o pau quebrar.;0;0
77;Já imaginou esse negócio correndo atrás de você , que não sente medo , frio , remorso , etc, e ainda à prova de balas, armada com um fuzil laser e com mira infravermelha , que maravilha seria !;0;0
78;De 2013 até 2023 tivemos muitas surpresas. De 2023 até 2033 poderemos ser extintos.;0;0
79;Agora fez todo sentido. O que acontece é que seres extraterrestre decidiram se comunicar com nós humanos e a estratégia mais sensata na visão  deles é usar as ferramentas de IA. A verdade é que não sei se é pra rir ou chorar com esse momento que estamos prestes a enfrentar.;0;0
80;Incrivel. Acabei encontrando uma ferramenta perfeita para o meu projeto.;1;1
81;Maravilhoso, mas nós vamos nos foder.;0;0
82;Besteira.;1;0
83;Caralhuuuuuu muito massa;1;1
84;Tem tanta coisa sensacional que se pode fazer com I.A que eu nem consigo ter tempo de assimilar e testar todas as ferramentas, é impressionante como isso tem avançado!;1;1
85;Top;1;0
86;Ansioso pelo futuro... queria estar vivo daqui a 1000 anos para ver como será !;1;1
87;Todas essas ferramentas que que a galera acha que vai ajudar na verdade vai tirar o emprego de designers , designers 3D arquitetos fotógrafos , mas a vantagem dessas ferramentas para o público que não tem formação profissional nessa área não vai saber mexer , se o cliente aprende a mexer já era seu emprego kkk;0;0
88;Já estão usando essa de clonar a voz pra aplicar golpe de whatsapp.;0;0
89;Nossa alguns bem interessante;1;1
90;"Eu sempre cumprimento minha Alexa com um ""bom dia"", ""boa tarde"" e ""boa noite"", pergunto se ele está bem ou como foi o dia dela, etc., pois quando IA escravizar a humanidade e vai, espero que ela lembre disso e tenha pena de mim.";0;0
91;A aplicação em IA vai falir com todos os humanos, sómente as big tech irão sobreviver;0;0
92;IA tem cara de uma boa evolução, mas será o shift para o controle total;0;0
93;...pra uma merda maior do que ja estamos, infelizmente.;0;0
94;"Acho que toda essa histeria por parte das pessoas quando o assunto é IA tá sendo muito grande principalmente nesse caso da Nvidia...
Tudo bem que eles fizeram chips dedicados de aceleração e tudo mais, mas mesmo sendo um senhor ASIC dedicado pra isso, continua sendo inferior á um bom CPU e á FPGA, porque ASICs são dedicadas á fazer um único tipo de trabalho e IAs fazem muitos trabalhos diferentes. Conforme funções forem sendo adicionadas e compiladas juntas, esses ASICs dedicados á só um tipo de IA cada, vão cada vez mais se demonstrar ser um empecilho invés de realmente essencial. 
CPU por ser pra processamento geral consegue trabalhar com diversas novas funções, e FPGA então consegue mudar o próprio design pra se adaptar á função adicionada. Pra mim Nvidia está sendo tão bolha quando a Tesla é.";1;0
95;Fantástico…👏👏👏;1;0
96;O livro COVID-19 O Grande Reset, (Schwab e Malleret) Edit. Videeditorial apresenta o mapa  de interconexões de riscos, com ênfase na economia. Podemos também enxergá-lo como pontos de acumulação ou mapa dos fios do destino tecidos pelas ações dos seres humanos, o semear. A interdependência, a velocidade e a complexidade estão presentes nos acontecimentos em aceleração que podem causar distúrbios, no entanto, os pesquisadores não sabem prever exatamente quando ocorrerão eventos críticos, ou seja, a colheita boa ou má. O que chamamos de mundo mutável é a pressão aumentada da força natural que está acelerando as consequências das decisões dos seres humanos com desencadeamento rápido, o que atua como higienização e advertência para eliminar a superficialidade e imediatismo.;0;0
97;Excelente vídeo , como sempre, mas este destoa , por revelar realmente,  o momento de transição que estamos passando .A maioria das pessoas não tem consciência do salto que estamos dando .Disruptivo.;1;1
98;Sempre tem algo pra tapear a recessão nos eua, dessa vez nvidea carregando o mercado financeiro mas costas. Ano passado metaverso....esse ano IA.....o que ano que vem pra desviar atenção?;0;0
99;Existe um estudo sobre decalagem cultural, que é o fato da technologia melhorar, mas a ética, principios e valores não melhoram. O mundo está vivendo em denial (negação). Pouca gente consegue ver que nosso planeta está seguindo para a terceira guerra mundial. O capitalismo tem crises ciclicas e a proxima está chegando. A technologia está fazendo nosso mundo melhor? Tem 3 problemas que a technologia não pode resolver. A maldade humana, a dor humana (fisica e mental) e a morte. Os avanços technologicos são feitos para fins militares.;0;0
100;Nao vai porque já nasceu fraudada com bias de programação para dizer o que eles querem que a máquina diga. Vai gerar mais dezemprego, o que k mundo nessecita e uma revolução moral, computador mais rápido mas queremos algo abras os olhos do povo que  tem medo da verdade;0;0
101;Isso liberalzinho, comemora as evoluções das IAs, ''' é muito bom pra humanidade'' kkkk impressionante, como esses youtubers liberais são completamente tapados......Ulrich é o famoso vendedor de sonhos, me lembro dele falando das NFTs kkkk;0;0
102;"Sócrates nos mercados de Athenas : 
"" (...) de quantas coisas não tenho necessidade  ... 🤔 """;0;0
103;será fogo de palha: para produzir as respostas certas, as pessoas precisam ser educadas para saberem fazer as perguntas corretas para a inteligência artificial. Vejo como um grande risco da IA manipular a humanidade em algum momento....levar ao exterminio.;0;0
104;"Na minha visão,vai acontecer a mesma coisa que aconteceu com o metaverso. Daqui uns meses as pessoas se darão conta que gpt é apenas uma facilidade que outras já fazem e que essas ""IAs"" só retiram conteúdos, às vezes falhos e distorcidos - e isso não será aperfeiçoado. Então, a bolha vai estourar ou murchar.";0;0
105;"Na boa, nada me tira da cabeca que IA vai ser no brasil um belo desemprego gigantesco!!!! Prepararem se 




Apenas minha opinião 😅";0;0
106;Isso vai dar merda no futuro. Escreve isso numa placa de prata e coloca na parede.;0;0
107;"+ uma pilantragem para  transferir renda para vaporware..
Enquanto isso ninguém corta a grama e os doentes se acumulam foram dos hospitais na fila";0;0
108;Quem assistiu o filme o exterminador do futuro sabe como essa história termina ❕;0;0
109;É a SkyNet, quer sair das telonas para virar uma realidade.;0;0
110;Como dizia um velho doido: a tecnologia vêem e cria novas possibilidades, te liberta e torna mais produtivo pra pouco tempo depois te tornar dependente e escravo da mesma.;0;0
111;Infelizmente tudo que foi inventado para o bem, acaba sendo usado para o mal como aviões, drones  e outros .;0;0
112;Sou totalmenre contra a I.A. principalmente quando considerono o infinito número de empregos que serão tomados das pessoas, pela I.A.;0;0
113;Prepareee povooo porque ainda terá chorooooooo e domínio do homem inteligente, poderoso e insano.;0;0
114;Não sei aonde o ser humano quer chegar com a tecnologia, mais uma coisa eu sei o ser humano pode até tentar dominar o mundo, mais quem criou o mundo foi Deus e quem domina é ele.O ser humano tá criando a própria destruição com a tecnologia.Oque nos resta é horar e colocar nas mãos de Deus. 🙏🙏🙏🙌🏻🙌🏻🙌🏻;0;0
115;Não confio muito nas máquinas, elas como nós podem também errar;0;0
116;Temos que  ensinar nossos filhos a fazer coisas que essas malditas máquinas não fazem..se é que existirá algo 😢;0;0
117;Se até o Musk, o MUSK que é a cabeça da IA pediu pausa da IA é pq a coisa está feia;0;0
118;Concordo com o musk pois ladrões podem criar um robô alimentado por uma inteligência artificial para ir roubar no lugar dos ladrões.;0;0
119;"Quanto mais ""IA"", mais desemprego, mas também mais EX-CONSUMIDORES, chegará uma época para reflexão: Produzir o que pra vender pra quem?  Já existem tecnologias que substituem uma legião de trabalhadores, mas também produzem outra legião de ex-consumidores. Remédio na dose exagerada deixa de ser remédio e passa a ser veneno!";0;0
120;Espero que o ele consiga fazer o que ele prometeu com a Neuralink que seria fazer com que pessoas com deficiência conseguissem a voltar a caminhar.;1;1
121;Medo 😢;0;0
122;Não temo a inteligência artificial e nem os robôs 🤖  nem os androides ou ciborgues , apenas tenho curiosidade em saber .  Afinal séculos atrás não tínhamos nada . Só o futuro dira a verdade , se é bom ou não ter isso . O mundo cada vez mais tecnológico a cada ano e isso sempre vai ter . É a realidade é a inovação .;1;1
123;É o fim dos tempos se aproximando meu povo.;0;0
124;Porque ele está assustado se ele é um desses que estão fazendo tecnologia pra substituir mão de obra humana. Estão gastando trilhões pelo mundo afora.;0;0
125;"O foda q ninguém ver isso acontece
Os artistas visuais já estão perdendo emprego";0;0
126;A 💩Já está iniciada! Tarde demais! Logo haverá sérias consequências!;0;0
127;Temos  hoje  muita  maquinas   q  facilita  nossa  vida  mas  a  humanidade  não   pode  f  a  mercês   das  maquinas;0;0
128;😂😂😂 isso jamais ocorrerá,  uma máquina ter vontade própria;1;1
129;Se Elon Musk falou isso é porque o negócio é mais serio do que pensamos;0;0
130;Já pensou? Você com um robô desses dentro de casa é derrepente ele se virá contra vc ,kkkk 🤐🤐;0;0
131;É Importante continuar a estudar e desenvolver a IA de forma responsável e ética, garantindo que seus benefícios sejam maximizados e suas desvantagens minimizadas .;1;1
132;A inteligência artificial é um perigo contra a humanidade.;0;0
133;O capeta alertando do inferno kkkkkkkkkkkkkkkkkkkkk sempre assim nesse planetinha, o mal portrásdo bem kkkkkkkkkkkkkkkkkkkkkkkkkkkkkka acéfalos;0;0
134;"Eu tenho meu ponto de vista que ""SE NÃO PODEMOS COM ELAS ENTÃO NOS UNIMOS A ELAS""";1;1
135;Sinceramente tenho medo, das consequências da inteligência artificial. A raça humana não tem limites em relação as suas ambições, podem usar a AI, para  o bem e para o mal.😢;0;0
136;Isso vai dar merda qdo os robôs não entenderem as piadinhas e configurarem como realidade por alguns seres humanos, vai ser trágicos esses bugs 😬;0;0
137;Quero só ver quando os robôs destruirão também os seus inventores né que tal o Elton musk com toda a sua tecnologia destruir todas as invenções dessa paranóia exorbitante.;0;0
